{
  "$schema": "https://json-schema.org/draft/2020-12/schema",
  "$id": "fff.densou.episodeManifest.v1.1",
  "title": "Densou Developed Long-form Episode Manifest",
  "type": "object",
  "additionalProperties": false,
  "required": [
    "schema_version",
    "schema_lineage",
    "artifact_id",
    "series_id",
    "season_id",
    "episode_id",
    "working_title",
    "source_basis_id",
    "source_packet_id",
    "source_revision_id",
    "target_form",
    "state",
    "segments",
    "viewer_artifact",
    "script_artifact",
    "unsupported_fact_count",
    "hidden_causal_bridge_count",
    "boundaries"
  ],
  "properties": {
    "schema_version": {
      "const": "fff.densou.episodeManifest.v1.1"
    },
    "schema_lineage": {
      "const": "fff.densou.episodeManifest.v1"
    },
    "artifact_id": {
      "const": "fff-densou-series-episode-quickwin-001"
    },
    "series_id": {
      "const": "densou-series"
    },
    "season_id": {
      "const": "densou-season-01"
    },
    "episode_id": {
      "const": "densou-s01e01-bellless-tower"
    },
    "working_title": {
      "type": "string",
      "minLength": 1
    },
    "source_basis_id": {
      "type": "string",
      "pattern": "^fff-densou-source-basis-[0-9a-f]{16}$"
    },
    "source_packet_id": {
      "type": "string",
      "minLength": 1
    },
    "source_revision_id": {
      "type": "string",
      "pattern": "^densou-[0-9a-f]{16}$"
    },
    "target_form": {
      "type": "object",
      "additionalProperties": false,
      "required": [
        "format",
        "editorial_window_seconds",
        "timing_status"
      ],
      "properties": {
        "format": {
          "const": "long_form_episode_development_treatment"
        },
        "editorial_window_seconds": {
          "const": 720
        },
        "timing_status": {
          "const": "review_timing_not_audio_or_picture_lock"
        }
      }
    },
    "state": {
      "const": "complete_development_packet_ready_for_local_review"
    },
    "segments": {
      "type": "array",
      "minItems": 8,
      "maxItems": 8,
      "items": {
        "type": "object",
        "additionalProperties": false,
        "required": [
          "segment_id",
          "start_seconds",
          "end_seconds",
          "title_ja",
          "treatment_ja",
          "claim_ids"
        ],
        "properties": {
          "segment_id": {
            "type": "string",
            "pattern": "^ep01-seg0[1-8]-"
          },
          "start_seconds": {
            "type": "integer",
            "minimum": 0
          },
          "end_seconds": {
            "type": "integer",
            "maximum": 720
          },
          "title_ja": {
            "type": "string",
            "minLength": 1
          },
          "treatment_ja": {
            "type": "string",
            "minLength": 1
          },
          "claim_ids": {
            "type": "array",
            "minItems": 1,
            "items": {
              "type": "string",
              "pattern": "^claim-"
            }
          }
        }
      }
    },
    "viewer_artifact": {
      "const": "densou-episode-001-review.html"
    },
    "script_artifact": {
      "const": "episode-001-review-treatment.md"
    },
    "unsupported_fact_count": {
      "const": 0
    },
    "hidden_causal_bridge_count": {
      "const": 0
    },
    "boundaries": {
      "type": "object",
      "additionalProperties": false,
      "required": [
        "final_canon",
        "rights_clearance",
        "production_approval",
        "publication",
        "upload",
        "release",
        "external_provider",
        "credentials",
        "voice_audio_video_generation"
      ],
      "properties": {
        "final_canon": {
          "const": false
        },
        "rights_clearance": {
          "const": false
        },
        "production_approval": {
          "const": false
        },
        "publication": {
          "const": false
        },
        "upload": {
          "const": false
        },
        "release": {
          "const": false
        },
        "external_provider": {
          "const": false
        },
        "credentials": {
          "const": false
        },
        "voice_audio_video_generation": {
          "const": false
        }
      }
    }
  }
}
